{"andar":0,"andares":0,"ano_construcao":0,"area":50000.0,"area_apresentacao":{"unit":"ha","value":5.0},"area_terreno":50000.0,"area_util":0.0,"bairro":"Warta","banheiros":0,"cidade":"Londrina","cliente_id":"00001","codigo":"TST-024","contact_info":{},"descricao":"ANÚNCIO SINTÉTICO PARA TESTES. Imóvel fictício, sem oferta comercial real.","features":[],"finalidade":"venda","fotos":[],"id":"00001-tst-024","location":{"latitude":-23.33,"longitude":-51.181,"zone":"Rural"},"media":[],"preco":1850000.0,"preco_aluguel":1850000.0,"preco_venda":1850000.0,"quartos":0,"regiao":"Rural","subtipo":"","suites":0,"tipo":"rural","titulo":"Área rural de cinco hectares","uf":"PR","vagas":0}
