{"andar":0,"andares":0,"ano_construcao":0,"area":92.0,"area_terreno":92.0,"area_util":0.0,"bairro":"Gleba Palhano","banheiros":2,"cidade":"Londrina","cliente_id":"00001","codigo":"TST-003","contact_info":{},"descricao":"ANÚNCIO SINTÉTICO PARA TESTES. Imóvel fictício, sem oferta comercial real.","features":[],"finalidade":"aluguel","fotos":["https://images.unsplash.com/photo-1560518883-ce09059eeffa?auto=format&fit=crop&w=1200&q=80"],"id":"00001-tst-003","location":{"latitude":-23.312,"longitude":-51.174,"zone":"Sul"},"media":[],"preco":2800.0,"preco_aluguel":2800.0,"preco_venda":2800.0,"quartos":3,"regiao":"Sul","subtipo":"","suites":1,"tipo":"apartamento","titulo":"Apartamento para alugar na Gleba Palhano","uf":"PR","vagas":2}
