{"andar":0,"andares":0,"ano_construcao":0,"area":300.0,"area_terreno":300.0,"area_util":0.0,"bairro":"Jardim Leonor","banheiros":0,"cidade":"Londrina","cliente_id":"00001","codigo":"TST-005","contact_info":{},"descricao":"ANÚNCIO SINTÉTICO PARA TESTES. Imóvel fictício, sem oferta comercial real.","features":[],"finalidade":"venda","fotos":["https://images.unsplash.com/photo-1560518883-ce09059eeffa?auto=format&fit=crop&w=1200&q=80"],"id":"00001-tst-005","location":{"latitude":-23.324,"longitude":-51.188,"zone":"Oeste"},"media":[],"preco":180000.0,"preco_aluguel":180000.0,"preco_venda":180000.0,"quartos":0,"regiao":"Oeste","subtipo":"","suites":0,"tipo":"terreno","titulo":"Terreno no Jardim Leonor","uf":"PR","vagas":0}
