{"andar":0,"andares":0,"ano_construcao":0,"area":1000.0,"area_apresentacao":{"unit":"m²","value":1000.0},"area_terreno":1000.0,"area_util":0.0,"bairro":"Limoeiro","banheiros":2,"cidade":"Londrina","cliente_id":"00001","codigo":"TST-006","contact_info":{},"descricao":"ANÚNCIO SINTÉTICO PARA TESTES. Imóvel fictício, sem oferta comercial real.","features":[],"finalidade":"venda","fotos":["https://images.unsplash.com/photo-1560518883-ce09059eeffa?auto=format&fit=crop&w=1200&q=80"],"id":"00001-tst-006","location":{"latitude":-23.33,"longitude":-51.16,"zone":"Rural"},"media":[],"preco":650000.0,"preco_aluguel":650000.0,"preco_venda":650000.0,"quartos":2,"regiao":"Rural","subtipo":"","suites":0,"tipo":"rural","titulo":"Chácara compacta em área rural","uf":"PR","vagas":3}
