{"andar":0,"andares":0,"ano_construcao":0,"area":20000.0,"area_apresentacao":{"unit":"ha","value":2.0},"area_terreno":20000.0,"area_util":0.0,"bairro":"Guaravera","banheiros":2,"cidade":"Londrina","cliente_id":"00001","codigo":"TST-007","contact_info":{},"descricao":"ANÚNCIO SINTÉTICO PARA TESTES. Imóvel fictício, sem oferta comercial real.","features":[],"finalidade":"venda","fotos":["https://images.unsplash.com/photo-1560518883-ce09059eeffa?auto=format&fit=crop&w=1200&q=80"],"id":"00001-tst-007","location":{"latitude":-23.3,"longitude":-51.167,"zone":"Rural"},"media":[],"preco":1350000.0,"preco_aluguel":1350000.0,"preco_venda":1350000.0,"quartos":3,"regiao":"Rural","subtipo":"","suites":1,"tipo":"rural","titulo":"Sítio produtivo de dois hectares","uf":"PR","vagas":4}
