{"andar":0,"andares":0,"ano_construcao":0,"area":58.0,"area_terreno":58.0,"area_util":0.0,"bairro":"Jardim Sabará","banheiros":1,"cidade":"Londrina","cliente_id":"00001","codigo":"TST-010","contact_info":{},"descricao":"ANÚNCIO SINTÉTICO PARA TESTES. Imóvel fictício, sem oferta comercial real.","features":[],"finalidade":"aluguel","fotos":["https://images.unsplash.com/photo-1560518883-ce09059eeffa?auto=format&fit=crop&w=1200&q=80"],"id":"00001-tst-010","location":{"latitude":-23.318,"longitude":-51.188,"zone":"Oeste"},"media":[],"preco":1650.0,"preco_aluguel":1650.0,"preco_venda":1650.0,"quartos":2,"regiao":"Oeste","subtipo":"","suites":0,"tipo":"apartamento","titulo":"Apartamento próximo à UEL","uf":"PR","vagas":1}
