{"andar":0,"andares":0,"ano_construcao":0,"area":78.0,"area_terreno":78.0,"area_util":0.0,"bairro":"Centro","banheiros":1,"cidade":"Londrina","cliente_id":"00001","codigo":"TST-001","contact_info":{},"descricao":"ANÚNCIO SINTÉTICO PARA TESTES. Imóvel fictício, sem oferta comercial real.","features":[],"finalidade":"venda","fotos":["https://images.unsplash.com/photo-1560518883-ce09059eeffa?auto=format&fit=crop&w=1200&q=80"],"id":"00001-tst-001","location":{"latitude":-23.3,"longitude":-51.16,"zone":"Central"},"media":[],"preco":420000.0,"preco_aluguel":420000.0,"preco_venda":420000.0,"quartos":2,"regiao":"Central","subtipo":"","suites":0,"tipo":"apartamento","titulo":"Apartamento no Centro","uf":"PR","vagas":1}
