{"andar":0,"andares":0,"ano_construcao":0,"area":138.0,"area_terreno":138.0,"area_util":0.0,"bairro":"Jardim Piza","banheiros":2,"cidade":"Londrina","cliente_id":"00001","codigo":"TST-022","contact_info":{},"descricao":"ANÚNCIO SINTÉTICO PARA TESTES. Imóvel fictício, sem oferta comercial real.","features":[],"finalidade":"aluguel","fotos":["https://images.unsplash.com/photo-1560518883-ce09059eeffa?auto=format&fit=crop&w=1200&q=80"],"id":"00001-tst-022","location":{"latitude":-23.318,"longitude":-51.167,"zone":"Sul"},"media":[],"preco":2600.0,"preco_aluguel":2600.0,"preco_venda":2600.0,"quartos":3,"regiao":"Sul","subtipo":"","suites":1,"tipo":"casa","titulo":"Casa térrea na Zona Sul","uf":"PR","vagas":2}
