{"andar":0,"andares":0,"ano_construcao":0,"area":132.0,"area_terreno":132.0,"area_util":0.0,"bairro":"Jardim Califórnia","banheiros":2,"cidade":"Londrina","cliente_id":"00001","codigo":"TST-011","contact_info":{},"descricao":"ANÚNCIO SINTÉTICO PARA TESTES. Imóvel fictício, sem oferta comercial real.","features":[],"finalidade":"venda","fotos":["https://images.unsplash.com/photo-1560518883-ce09059eeffa?auto=format&fit=crop&w=1200&q=80"],"id":"00001-tst-011","location":{"latitude":-23.324,"longitude":-51.16,"zone":"Leste"},"media":[],"preco":460000.0,"preco_aluguel":460000.0,"preco_venda":460000.0,"quartos":3,"regiao":"Leste","subtipo":"","suites":1,"tipo":"casa","titulo":"Casa no Jardim Califórnia","uf":"PR","vagas":2}
