{"andar":0,"andares":0,"ano_construcao":0,"area":620.0,"area_terreno":620.0,"area_util":0.0,"bairro":"Cinco Conjuntos","banheiros":2,"cidade":"Londrina","cliente_id":"00001","codigo":"TST-009","contact_info":{},"descricao":"ANÚNCIO SINTÉTICO PARA TESTES. Imóvel fictício, sem oferta comercial real.","features":[],"finalidade":"aluguel","fotos":["https://images.unsplash.com/photo-1560518883-ce09059eeffa?auto=format&fit=crop&w=1200&q=80"],"id":"00001-tst-009","location":{"latitude":-23.312,"longitude":-51.181,"zone":"Norte"},"media":[],"preco":8500.0,"preco_aluguel":8500.0,"preco_venda":8500.0,"quartos":0,"regiao":"Norte","subtipo":"","suites":0,"tipo":"galpao","titulo":"Galpão na Zona Norte","uf":"PR","vagas":6}
