{"andar":0,"andares":0,"ano_construcao":0,"area":160.0,"area_terreno":160.0,"area_util":0.0,"bairro":"Conjunto Vivi Xavier","banheiros":2,"cidade":"Londrina","cliente_id":"00001","codigo":"TST-014","contact_info":{},"descricao":"ANÚNCIO SINTÉTICO PARA TESTES. Imóvel fictício, sem oferta comercial real.","features":[],"finalidade":"aluguel","fotos":["https://images.unsplash.com/photo-1560518883-ce09059eeffa?auto=format&fit=crop&w=1200&q=80"],"id":"00001-tst-014","location":{"latitude":-23.306,"longitude":-51.181,"zone":"Norte"},"media":[],"preco":4200.0,"preco_aluguel":4200.0,"preco_venda":4200.0,"quartos":0,"regiao":"Norte","subtipo":"","suites":0,"tipo":"comercial","titulo":"Loja térrea na Avenida Saul Elkind","uf":"PR","vagas":3}
