{"andar":0,"andares":0,"ano_construcao":0,"area":360.0,"area_terreno":360.0,"area_util":0.0,"bairro":"Parque das Indústrias","banheiros":0,"cidade":"Londrina","cliente_id":"00001","codigo":"TST-017","contact_info":{},"descricao":"ANÚNCIO SINTÉTICO PARA TESTES. Imóvel fictício, sem oferta comercial real.","features":[],"finalidade":"venda","fotos":["https://images.unsplash.com/photo-1560518883-ce09059eeffa?auto=format&fit=crop&w=1200&q=80"],"id":"00001-tst-017","location":{"latitude":-23.324,"longitude":-51.167,"zone":"Sul"},"media":[],"preco":240000.0,"preco_aluguel":240000.0,"preco_venda":240000.0,"quartos":0,"regiao":"Sul","subtipo":"","suites":0,"tipo":"terreno","titulo":"Terreno na Zona Sul","uf":"PR","vagas":0}
