{"andar":0,"andares":0,"ano_construcao":0,"area":110.0,"area_terreno":110.0,"area_util":0.0,"bairro":"Aeroporto","banheiros":2,"cidade":"Londrina","cliente_id":"00001","codigo":"TST-015","contact_info":{},"descricao":"ANÚNCIO SINTÉTICO PARA TESTES. Imóvel fictício, sem oferta comercial real.","features":[],"finalidade":"aluguel","fotos":["https://images.unsplash.com/photo-1560518883-ce09059eeffa?auto=format&fit=crop&w=1200&q=80"],"id":"00001-tst-015","location":{"latitude":-23.312,"longitude":-51.188,"zone":"Leste"},"media":[],"preco":2200.0,"preco_aluguel":2200.0,"preco_venda":2200.0,"quartos":3,"regiao":"Leste","subtipo":"","suites":1,"tipo":"casa","titulo":"Casa para alugar no Aeroporto","uf":"PR","vagas":2}
