{"andar":0,"andares":0,"ano_construcao":0,"area":68.0,"area_terreno":68.0,"area_util":0.0,"bairro":"Conjunto Parigot de Souza","banheiros":1,"cidade":"Londrina","cliente_id":"00001","codigo":"TST-021","contact_info":{},"descricao":"ANÚNCIO SINTÉTICO PARA TESTES. Imóvel fictício, sem oferta comercial real.","features":[],"finalidade":"venda","fotos":["https://images.unsplash.com/photo-1560518883-ce09059eeffa?auto=format&fit=crop&w=1200&q=80"],"id":"00001-tst-021","location":{"latitude":-23.312,"longitude":-51.16,"zone":"Norte"},"media":[],"preco":310000.0,"preco_aluguel":310000.0,"preco_venda":310000.0,"quartos":2,"regiao":"Norte","subtipo":"","suites":0,"tipo":"apartamento","titulo":"Apartamento familiar na Zona Norte","uf":"PR","vagas":1}
